<?xml version="1.0"?>
<notes xmlns:xsi="http://www.w3.org/2001/XMLSchema-instance"
    xsi:noNamespaceSchemaLocation="notes.xsd">
    <note>
        <to>Tove</to>
        <from>Jani</from>
        <heading>Reminder</heading>
        <body length="100">Don't forget me this weekend!</body>
    </note>
    <note>
        <to>Pepe</to>
        <from>Ana</from>
        <heading>Salutacio</heading>
        <body length="100">Hola</body>
    </note>
</notes>